Movie Name,Rating,Year,Director,Genre,Summary,Genre List
Udaan,8.1,2010,Vikramaditya Motwane,Drama,"Expelled from his school, a 16-year old boy returns home to his abusive and oppressive father.",Drama
Gangs of Wasseypur,8.2,2012,Anurag Kashyap,Action,"A clash between Sultan and Shahid Khan leads to the expulsion of Khan from Wasseypur, and ignites a deadly blood feud spanning three generations.","Action, Comedy, Crime"
Like Stars on Earth,8.3,2007,Aamir Khan,Drama,"An eight-year-old boy is thought to be a lazy trouble-maker, until the new art teacher has the patience and compassion to discover the real problem behind his struggles in school.","Drama, Family"
Dev.D,7.9,2009,Anurag Kashyap,Comedy,"After breaking up with his childhood sweetheart, a young man finds solace in drugs. Meanwhile, a teenage girl is caught in the world of prostitution. Will they be destroyed, or will they fin... Read all","Comedy, Drama, Romance"
Swades,8.2,2004,Ashutosh Gowariker,Drama,A successful Indian scientist returns to an Indian village to take his nanny to America with him and in the process rediscovers his roots.,"Drama, Musical"
3 Idiots,8.4,2009,Rajkumar Hirani,Comedy,"Two friends are searching for their long lost companion. They revisit their college days and recall the memories of their friend who inspired them to think differently, even as the rest of t... Read all","Comedy, Drama"
OMG: Oh My God!,8.1,2012,Umesh Shukla,Comedy,A shopkeeper takes God to court when his shop is destroyed by an earthquake.,"Comedy, Drama, Fantasy"
Rang De Basanti,8.1,2006,Rakeysh Omprakash Mehra,Comedy,"The story of six young Indians who assist an English woman to film a documentary on the freedom fighters from their past, and the events that lead them to relive the long-forgotten saga of f... Read all","Comedy, Crime, Drama"
Omkara,8.0,2006,Vishal Bhardwaj,Action,A politically-minded enforcer's misguided trust in his lieutenant leads him to suspect his wife of infidelity in this adaptation of Shakespeare's 'Othello'.,"Action, Crime, Drama"
Pink,8.1,2016,Aniruddha Roy Chowdhury,Crime,"When three young women are implicated in a crime, a retired lawyer steps forward to help them clear their names.","Crime, Drama, Thriller"
Talvar,8.1,2015,Meghna Gulzar,Crime,An experienced investigator confronts several conflicting theories about the perpetrators of a violent double homicide.,"Crime, Drama, Mystery"
Chak De! India,8.1,2007,Shimit Amin,Drama,"Kabir Khan, the coach of the Indian Women's National Hockey Team, dreams of making his all-girls team emerge victorious against all odds.","Drama, Family, Sport"
Black,8.1,2005,Sanjay Leela Bhansali,Drama,"The cathartic tale of a young woman who can't see, hear, or speak, and the teacher who brings a ray of light into her dark world.",Drama
Andaz Apna Apna,8.0,1994,Rajkumar Santoshi,Action,Two slackers competing for the affections of an heiress inadvertently become her protectors from an evil criminal.,"Action, Comedy, Romance"
Laal Rang,7.8,2016,Syed Ahmad Afzal,Comedy,The friendship of two men is tested when things go wrong in their blood theft business.,"Comedy, Crime, Drama"
Drishyam,8.2,2015,Nishikant Kamat,Crime,"Desperate measures are taken by a man who tries to save his family from the dark side of the law, after they commit an unexpected crime.","Crime, Drama, Mystery"
Dangal,8.3,2016,Nitesh Tiwari,Action,Former wrestler Mahavir Singh Phogat and his two wrestler daughters struggle towards glory at the Commonwealth Games in the face of societal oppression.,"Action, Biography, Drama"
Black Friday,8.4,2004,Anurag Kashyap,Action,"A film about the investigations following the 1993 serial Bombay bomb blasts, told through the different stories of the people involved --police, conspirators, victims, middlemen.","Action, Crime, Drama"
Thirst,8.3,1957,Guru Dutt,Drama,"Vijay, a talented but indigent poet, struggles for love and recognition in this selfish world.","Drama, Musical, Romance"
Jaane Bhi Do Yaaro,8.3,1983,Kundan Shah,Comedy,"Two photographers, who are employed by a magazine editor to expose the scandalous activities of the rich, come across corruption by a builder and accidentally photograph a murder.","Comedy, Crime, Drama"
A Wednesday,8.1,2008,Neeraj Pandey,Action,A retiring police officer reminisces about the most astounding day of his career. About a case that was never filed but continues to haunt him in his memories - the case of a man and a Wedne... Read all,"Action, Crime, Drama"
Dil Chahta Hai,8.1,2001,Farhan Akhtar,Comedy,"Three inseparable childhood friends are just out of college. Nothing comes between them - until they each fall in love, and their wildly different approaches to relationships creates tension... Read all","Comedy, Drama, Romance"
PK,8.1,2014,Rajkumar Hirani,Comedy,An alien on Earth loses the only device he can use to communicate with his spaceship. His innocent nature and child-like questions force the country to evaluate the impact of religious views... Read all,"Comedy, Drama, Sci-Fi"
Mother India,7.8,1957,Mehboob Khan,Action,"In this melodrama, a poverty-stricken woman raises her sons through many trials and tribulations. But no matter the struggles, she always sticks to her own moral code.","Action, Comedy, Drama"
Anand,8.1,1971,Hrishikesh Mukherjee,Drama,"The story of a terminally ill man who wishes to live life to the fullest before the inevitable occurs, as told by his best friend.","Drama, Musical"
Gol Maal,8.5,1979,Hrishikesh Mukherjee,Comedy,A man's simple lie to secure his job escalates into more complex lies when his orthodox boss gets suspicious.,"Comedy, Romance"
Chupke Chupke,8.3,1975,Hrishikesh Mukherjee,Comedy,A newly wedded husband plays a practical joke on his wife's family with full support from his wife and friends.,"Comedy, Drama, Romance"
Guide,8.3,1965,Vijay Anand,Drama,"When mistaken to be a sage by some villagers, an ex-tour guide reflects on his past and lost love to search for spiritual wisdom to guide the villagers.","Drama, Romance"
Khosla Ka Ghosla!,8.2,2006,Dibakar Banerjee,Comedy,A Delhi-based retired middle-class man tries half-heartedly to get his land back from a swindling property dealer with the help of his sons and their friends.,"Comedy, Crime, Drama"
Shahid,8.2,2012,Hansal Mehta,Biography,"The account of Human Rights lawyer Shahid Azmi, an ordinary citizen with an extraordinary commitment to justice.","Biography, Drama"
Mughal-E-Azam,8.1,1960,K. Asif,Drama,A 16th century prince falls in love with a court dancer and battles with his emperor father.,"Drama, Romance, War"
Paan Singh Tomar,8.2,2012,Tigmanshu Dhulia,Action,"The story of Paan Singh Tomar, an Indian athlete and seven-time national steeplechase champion who becomes one of the most feared dacoits in Chambal Valley after his retirement.","Action, Biography, Crime"
Hera Pheri,8.2,2000,Priyadarshan,Action,"Three unemployed men look for answers to all their money problems - but when their opportunity arrives, will they know what to do with it?","Action, Comedy, Crime"
Queen,8.1,2013,Vikas Bahl,Adventure,A Delhi girl from a traditional family sets out on a solo honeymoon after her marriage gets cancelled.,"Adventure, Comedy, Drama"
Jo Jeeta Wohi Sikandar,8.1,1992,Mansoor Khan,Comedy,"A rich brat and a poor chap try to woo a girl, with their rivalry culminating in the most prestigious college event - the marathon cycle race.","Comedy, Drama, Romance"
Satya,8.3,1998,Ram Gopal Varma,Action,An innocent man is embroiled in underworld after being falsely charged and sets out to punish the perpetrators who subjected his life to misery.,"Action, Crime, Drama"
Bhaag Milkha Bhaag,8.2,2013,Rakeysh Omprakash Mehra,Biography,"The truth behind the ascension of Milkha Singh, who was scarred by of the India-Pakistan partition.","Biography, Drama, Sport"
The Legend of Bhagat Singh,8.1,2002,Rajkumar Santoshi,Action,The story of a young revolutionary who raised an armed resistance against the British rule in India.,"Action, Biography, Drama"
Manjhi: The Mountain Man,8.0,2015,Ketan Mehta,Biography,"Using only a hammer and a chisel, a man spends twenty-two years carving a road through a treacherous mountain.","Biography, Drama"
Neerja,7.6,2016,Ram Madhvani,Biography,"The story of courageous Neerja Bhanot, who sacrificed her life while protecting the lives of 359 passengers on Pan Am Flight 73 in 1986 when it was hijacked by a terrorist organization.","Biography, Drama, Thriller"
M.S. Dhoni: The Untold Story,8.0,2016,Mathur Goswami,Biography,The untold story of Mahendra Singh Dhoni's journey from ticket collector to trophy collector - the world-cup-winning captain of the Indian Cricket Team.,"Biography, Drama, Sport"
No One Killed Jessica,7.2,2011,Raj Kumar Gupta,Biography,"A journalist, who is more of an activist teams up with the sister of a murdered model, as she gets interested in the case and wants to bring justice to her case.","Biography, Crime, Drama"
Manto,7.3,2018,Nandita Das,Biography,The film is a biographical account of writer Saadat Hasan Manto's life and is set in 1940s India.,"Biography, Drama"
Ek Doctor Ki Maut,8.3,1990,Tapan Sinha,Biography,"After years of painstaking research at the cost of his domestic pleasure, Dr. Dipankar Roy discovers a vaccine for leprosy. The news is flashed over television and overnight, an insignifican... Read all","Biography, Drama"
Soorma,7.3,2018,Shaad Ali,Biography,"Soorma is the story of the triumph of the human spirit, about a player, who made headlines for his miraculous comeback after facing a near death experience through sheer determination, hard ... Read all","Biography, Drama, Sport"
"Gandhi, My Father",7.3,2007,Feroz Abbas Khan,Biography,The account of troubled relationship between Mahatma Gandhi and his eldest son.,"Biography, Drama, History"
Harishchandrachi Factory,8.4,2009,Paresh Mokashi,Biography,"In 1913 India's cinema industry is born from Dadasaheb Phalke's efforts to make Raja Harishchandra (1913), India's first feature-length B&W silent film.","Biography, Comedy, Drama"
Rakta Charitra,7.6,2010,Ram Gopal Varma,Action,A killer bandit decides to become a politician in order to avenge deaths in his family.,"Action, Biography, Crime"
Super 30,7.9,2019,Vikas Bahl,Biography,Based on the life of Patna-based mathematician Anand Kumar who runs the famed Super 30 program for IIT aspirants in Patna.,"Biography, Drama"
Aligarh,7.8,2015,Hansal Mehta,Biography,"A gay, linguistic professor living in a small orthodox city must deal with the aftermath of a sting operation that puts his sexual orientation in front of the entire nation.","Biography, Crime, Drama"
Saand Ki Aankh,7.5,2019,Tushar Hiranandani,Biography,"Both over the age of 60, Chandro Tomar and Prakashi Tomar inspire other women in India when they demonstrate their expert sharpshooting skills.","Biography, Drama"
Mary Kom,6.8,2014,Omung Kumar,Action,"A chronicle of the life of Indian boxer Mary Kom, who went through several hardships before audaciously accomplishing her ultimate dream.","Action, Biography, Drama"
Tanhaji: The Unsung Warrior,7.5,2020,Om Raut,Action,"Tanhaji Malusare, a military chieftain in the army of the Maratha king Shivaji, leads the charge to capture the strategically important Kondhana fort guarded by the army of the fierce Rajput... Read all","Action, Biography, Drama"
Bandit Queen,7.5,1994,Shekhar Kapur,Action,The story of the bandit queen Phoolan Devi who was sent to prison in 1983 and got free in 1994.,"Action, Biography, Crime"
Rang Rasiya,7.0,2008,Ketan Mehta,Biography,A look into the life of 19th century Indian painter Raja Ravi Varma.,"Biography, Drama, Romance"
Sarbjit,7.3,2016,Omung Kumar,Biography,"Biopic of Sarabjit Singh, a farmer residing at Bhikiwind, Punjab, near the Indo-Pak border, crossed the border after having a couple of drinks. However, he was mistaken to be an Indian spy a... Read all","Biography, Drama"
Omerta,7.1,2017,Hansal Mehta,Action,"A recounting of the story of infamous British-born terrorist Ahmed Omar Saeed Sheikh, who kidnapped and murdered Wall Street Journal reporter Daniel Pearl in 2002.","Action, Biography, Crime"
Kaagaz,7.3,2021,Satish Kaushik,Biography,A satirical comedy about a common man and the struggle he goes through to prove his existence after being falsely being declared dead on government records.,"Biography, Comedy, Drama"
Viruddh... Family Comes First,7.0,2005,Mahesh Manjrekar,Drama,An ordinary 60 plus couple - Vidhyadhar Patwardhan and his wife are forced to search for their faith in human values and society after the death of their only son Amar. In the process they u... Read all,"Drama, Family"
Veer-Zaara,7.8,2004,Yash Chopra,Drama,"""Veer-Zaara"" is a saga of love, separation, courage, and sacrifice. A love story that is an inspiration and will remain a legend forever.","Drama, Family, Musical"
Toolsidas Junior,7.4,2022,Mridul Toolsidas,Drama,"Watching his father lose the 1994 Club Snooker Championship, 13-year-old Midi takes on the impossible journey to bring his father's name on the Winner's Board.","Drama, Family, Sport"
The Blue Umbrella,7.3,2005,Vishal Bhardwaj,Comedy,"In a small village when a little girl's prescious umbrella is stolen, things goes wrong for a greedy tea seller who was very much interested in buying that umbrella from her.","Comedy, Drama, Family"
Tapasya,7.2,1976,Anil Ganguly,Drama,"The oldest daughter of an old and ailing man falls in love with the doctor treating her father, but the mother of the doctor insists that the girl must leave everything she does and stay wit... Read all","Drama, Family"
Stanley Ka Dabba,7.8,2011,Amole Gupte,Comedy,"A school-teacher, who forces children to share their food with him, forbids one from entering the school until he brings his own Tiffin/Lunch-box.","Comedy, Drama, Family"
Silsila,7.2,1981,Yash Chopra,Drama,"SILSILA is a love story, thwarted by society's demands, which reappears as adultery but can it survive in the face of society?","Drama, Family, Romance"
Shubh Nikah,7.2,2023,Arshad Siddiqui,Comedy,"Families of two different cultures join hands and come together for love, humanity, and peace with a strong message of national integrity","Comedy, Drama, Family"
Shri Krishna Leela,7.9,1971,Homi Wadia,Adventure,"Maharaj Kans rules Mathura and lives a lavish and wealthy lifestyle. He gets his sister, Devki, married to Vasudev, but shortly after the marriage finds out that Devki's 8th child will kill ... Read all","Adventure, Comedy, Drama"
Sharmaji Namkeen,7.5,2022,Hitesh Bhatia,Comedy,A light-hearted coming-of-age story of a lovable 60-year-old-man.,"Comedy, Drama, Family"
Saudagar,7.4,1973,Sudhendu Roy,Drama,A calculative man schemes to deceit a poor but young widow for his personal monetary gains.,"Drama, Family"
Sansar,8.0,1951,S.S. Vasan,Drama,"A struggling clerk lives with his wife and two children. Their blissful life is threatened with the arrival of his scheming mother and sister. A short time later, the clerk disappears, aband... Read all","Drama, Family"
Sanjh Aur Savera,7.2,1964,Hrishikesh Mukherjee,Drama,"Dr. Shankar Chaudhry lives a wealthy lifestyle in Bombay with his widowed mom, Rukmini, and younger sister, Manju. His mom would like him to get married to Ambala-based Advocate Madhusudan's... Read all","Drama, Family"
Saanjh,8.1,2017,Ajay K Saklanni,Drama,"When Saanjh's father sends her away to live with her grandmother in a remote village, she feels dejected and tries to escape. However with time as her bond with her grandmother becomes stron... Read all","Drama, Family"
Ribbon,6.9,2017,Rakhee Sandilya,Drama,A young working urban couple is overwhelmed with the birth of a baby girl and find that parenthood comes with its own challenges.,"Drama, Family"
Pyaasa Sawan,7.4,1981,Dasari Narayana Rao,Family,"While looking for employment, Chandrakant is mistaken for the son of a wealthy landlord by Prabhudas, who wants him to marry his only daughter, Shanti. By the time they find out the truth, i... Read all","Family, Romance"
Pooja Ke Phool,7.0,1964,A. Bhimsingh,Musical,"Balraj (Dharmendra), affectionately called Raj, by his elder brother (Nana Palsikar) and sister Vija (Madhumati), is a student in college in the arts semester. As the family is not very rich... Read all","Musical, Drama, Family"
Pocket Maar,7.2,1956,Harnam Singh Rawail,Action,"Roshan lives a poor lifestyle in Bombay with his widowed mother, who thinks he is gainfully employed, but Roshan has made crime his career and picks pockets and gambles for a living. A gangs... Read all","Action, Crime, Drama"
Piya Ka Ghar,7.0,1972,Basu Chatterjee,Comedy,"Malti Shankar lives in a fairly large house in a small town in India with her mom and dad, while her paternal uncle, Gauri Shankar, who has literally brought Malti up, lives in the house nex... Read all","Comedy, Drama, Family"
Parivar,7.5,1956,Asit Kumar Sen,Comedy,"A joint family consisting of four brothers, their wives, and their respective children, living under one roof. Some of the brothers are professionls, one a lawyer, a doctor, and others busin... Read all","Comedy, Drama, Family"
Parichay,7.6,1972,Gulzar,Drama,"In desperate need of a job, unemployed Ravi (Jeetendra) goes to his maternal uncle (A.K. Hangal) and aunt (Leela Mishra) in their village for a few days. His uncle decides that he can be a s... Read all","Drama, Family, Musical"
Pardes,8.3,1950,M. Sadiq,Drama,"Rajan, a teacher, falls in love with Chanda, a wealthy girl. However, he decides to go away from Chanda to earn money.","Drama, Family"
Kapoor & Sons,7.7,2016,Shakun Batra,Comedy,The story about two brothers who visit their dysfunctional family for their grandfather's birthday party.,"Comedy, Crime, Drama"
Ankhiyon Ke Jharokhon Se,7.6,1978,Hiren Nag,Drama,"A young man must deal with a broken engagement ceremony, while his to-be fiancée waits to be treated for blood cancer.","Drama, Family, Romance"
Manzil,6.9,1979,Basu Chatterjee,Drama,"Ajay Chandra, a hard working and ambitious young man, who dreams of bigger things than a small job. He has dreams of starting his own business. One day he meets Aruna at a friends wedding an... Read all","Drama, Romance, Family"
Heer Raanjha,7.1,1970,Chetan Anand,Musical,"Tragic love story. Punjabi ""Romeo and Juliet"".","Musical, Romance, Drama"
Mili,7.4,1975,Hrishikesh Mukherjee,Drama,"A reclusive, depressed man and a bubbly young woman fall in love but then find out that she has cancer.","Drama, Romance, Family"
Kal Aaj Aur Kal,6.5,1971,Randhir Kapoor,Family,"Widower Ram Kapoor lives a very wealthy lifestyle in Bombay, but is very lonely, as his only child, a son named Rajesh, lives abroad, and his aged dad, Diwan Bahadur, lives in the village. R... Read all","Family, Musical, Romance"
Baaz,6.6,1953,Guru Dutt,Action,"Nisha lives a poor lifestyle in the Portuguese-ruled Malabar region in India along with her widowed dad, Narayan Das. Both father and daughter are opposed to the oppressive rule of the Portu... Read all","Action, Adventure, Musical"
Kora Kagaz,7.3,1974,Anil Ganguly,Drama,"By the time we learn to live, life is gone.","Drama, Musical, Family"
Ek Saal,7.7,1957,Devendra Goel,Drama,The father of a dying woman pays a con artist to make his daughter's final year a happy one.,"Drama, Family, Romance"
Love in Simla,6.9,1960,R.K. Nayyar,Comedy,"After the untimely death of her father and step-mother, Sonia is orphaned and lives with her aunt and paternal uncle (Mrs. and General Rajpal Singh). Sonia is plain-looking as her real mothe... Read all","Comedy, Drama, Family"
Dard (Conflict of Emotions),7.4,1981,Ambrish Sangal,Drama,"Prosecuting Attorney Seema proceeds with the criminal prosecution of Deepak Srivastav, who is accused of Murder. She submits to the Judge to not be fooled by the innocent looks and the silen... Read all","Drama, Crime, Family"
Sholay,8.1,1975,Ramesh Sippy,Action,"After his family is murdered by a notorious and ruthless bandit, a former police officer enlists the services of two outlaws to capture the bandit.","Action, Adventure, Comedy"
Lagaan: Once Upon a Time in India,8.1,2001,Ashutosh Gowariker,Drama,The people of a small village in Victorian India stake their future on a game of cricket against their ruthless British rulers.,"Drama, Musical, Sport"
Zindagi Na Milegi Dobara,8.2,2011,Zoya Akhtar,Comedy,Three friends decide to turn their fantasy vacation into reality after one of their friends gets engaged.,"Comedy, Drama, Musical"
Kal Ho Naa Ho,7.9,2003,Nikkhil Advani,Comedy,"Naina, an introverted, perpetually depressed girl's life changes when she meets Aman. But Aman has a secret of his own which changes their lives forever. Embroiled in all this is Rohit, Nain... Read all","Comedy, Drama, Musical"
Mr. India,7.7,1987,Shekhar Kapur,Action,"A poor but big-hearted man takes orphans into his home. After discovering his scientist father's invisibility device, he rises to the occasion and fights to save his children and all of Indi... Read all","Action, Comedy, Drama"
Agneepath,7.6,1990,Mukul Anand,Action,"A young boy's quest for revenge leads him to become a gangster as an adult, and with each day he becomes more and more like his enemies. Can he find vengeance and redemption?","Action, Crime, Drama"
Kabhi Haan Kabhi Naa,7.6,1994,Kundan Shah,Comedy,A dreamer falls for a girl who is in love with someone else and tries to create a rift between her and the man she loves.,"Comedy, Drama, Music"
Kuch Kuch Hota Hai,7.5,1998,Karan Johar,Comedy,"During their college years, Anjali was in love with her best-friend Rahul, but he had eyes only for Tina. Years later, Rahul and the now-deceased Tina's eight-year-old daughter attempts to r... Read all","Comedy, Drama, Musical"
Baazigar,7.6,1993,Abbas Alibhai Burmawalla,Crime,"A young man with a vendetta against a business tycoon seduces the man's younger daughter, but she begins to suspect her new lover's connection with her elder sister and his ulterior motive.","Crime, Drama, Musical"
Devdas,7.5,2002,Sanjay Leela Bhansali,Drama,"After his wealthy family prohibits him from marrying the woman he is in love with, Devdas Mukherjee's life spirals further and further out of control as he takes up alcohol and a life of vic... Read all","Drama, Musical, Romance"
Qayamat Se Qayamat Tak,7.4,1988,Mansoor Khan,Drama,"Despite knowing that their respective families are bitter enemies, Raj and Rashmi fall in love with each other and decide to elope.","Drama, Musical, Romance"
Hum Dil De Chuke Sanam,7.4,1999,Sanjay Leela Bhansali,Comedy,"Nandini has to choose between Sameer, the man who taught her to fall in love; and Vanraj, the man from whom she learnt how to abide and fulfill promises of love.","Comedy, Drama, Musical"
Hum Aapke Hain Koun..!,7.5,1994,Sooraj R. Barjatya,Comedy,"Prem and Nisha meet and fall in love at the wedding of their elder siblings, but their plans to be together are put in jeopardy when Nisha's sister dies, leaving behind a baby.","Comedy, Drama, Musical"
Rangeela,7.4,1995,Ram Gopal Varma,Comedy,A middle-class young woman who dreams of Bollywood fame is caught in a love triangle between her childhood friend and a famous actor.,"Comedy, Drama, Musical"
Rehnaa Hai Terre Dil Mein,7.5,2001,Gautham Vasudev Menon,Comedy,"Maddy impersonates Rajeev, the person his love interest, Reena, is about to marry and attempts to woo her. However, he is unprepared for the moment when the truth will be revealed.","Comedy, Drama, Musical"
Kabhi Khushi Kabhie Gham...,7.4,2001,Karan Johar,Drama,"After marrying a poor woman, rich Rahul is disowned by his father and moves to London to build a new life. Years later, his now-grown younger brother Rohan embarks on a mission to bring Rahu... Read all","Drama, Musical, Romance"
Life in a Metro,7.4,2007,Anurag Basu,Comedy,"Six different stories, about nine people, each with different issues and problems, all occurring within one place: the METRO.","Comedy, Drama, Musical"
Khiladi,7.1,1992,Abbas Alibhai Burmawalla,Action,"Two friends wage bets for money and fun. There comes a time where they race to win the biggest bet, for they know that their lives depend on it.","Action, Musical, Mystery"
Maine Pyar Kiya,7.3,1989,Sooraj R. Barjatya,Drama,"After Suman's father leaves her in the care of another family while he travels abroad, she falls in love with Prem. However, in order to for them to marry, Prem has to prove to Suman's fathe... Read all","Drama, Musical, Romance"
Parineeta,7.2,2005,Pradeep Sarkar,Drama,The lifelong romance between Lolita (Balan) and Shekar (Khan) is upset by the arrival of another man.,"Drama, Musical, Romance"
Saajan,7.2,1991,Lawrence D'Souza,Drama,A poet (Sanjay Dutt) and his best friend (Salman Khan) fall in love with the same woman (Madhuri Dixit).,"Drama, Musical, Romance"
Airlift,7.9,2016,Raja Menon,Action,"When Iraq invades Kuwait in August 1990, a callous Indian businessman becomes the spokesperson for more than 170,000 stranded countrymen.","Action, Drama, History"
Border,7.9,1997,J.P. Dutta,Action,"In 1971, along the border region of Longewala, a small battalion of Indian soldiers goes up against a large Pakistani strike force.","Action, Drama, History"
Parmanu: The Story of Pokhran,7.6,2018,Abhishek Sharma,Action,"Ashwat Raina and his teammates arrive in Pokhran to re-conduct a confidential nuclear test, where they face challenges from the American Lacrosse satellite and local spies.","Action, Drama, History"
Jodhaa Akbar,7.5,2008,Ashutosh Gowariker,Action,"A sixteenth century love story about a marriage of alliance that gave birth to true love between a great Mughal emperor, Akbar, and a Rajput princess, Jodha.","Action, Drama, History"
Uri: The Surgical Strike,8.2,2019,Aditya Dhar,Action,"Indian army special forces execute a covert operation, avenging the killing of fellow army men at their base by a terrorist group.","Action, Drama, History"
